### ISSUE TITLE
'Timed out trying to read data from the socket stream!' when using Execute() method to send PORT command

### ISSUE THREAD

**Issue by JimbobSquelchy** [robinrodricks/FluentFTP#718]
**FTP OS:** Windows Server 2016

**FTP Server:** FileZilla Server 0.9.60 beta

**Computer OS:** Windows 10 (1803)

**FluentFTP Version:** 33.2.0

My application needs to check FTP details that a user has entered, eg hostname, username, password and directory. It also has to check that FXP is supported (without actually transferring any files). It tries to do this by sending a PORT command with an IP address within the same range (but obviously not the same IP address as the client or server).

```c#
var ftp = new FtpClient(hostname, username, password);
ftp.Connect();
credentialsValid = true;
pathExists = ftp.DirectoryExists("/Video");
var reply = ftp.Execute("PORT 10,96,209,114,54,54");
supportsFxp = reply.Success;
ftp.Disconnect();
```

Unfortunately, when I call the Execute() method with a PORT command, a timeout occurs. In fact, looking at the FTP Server logs, and even a WireShark packet capture, the command is never actually sent:

*FileZilla Log*
```
(000040)30/04/2021 09:49:46 - (not logged in) (10.54.253.74)> Connected on port 21, sending welcome message...
(000040)30/04/2021 09:49:46 - (not logged in) (10.54.253.74)> 220-FileZilla Server 0.9.60 beta
(000040)30/04/2021 09:49:46 - (not logged in) (10.54.253.74)> 220-written by Tim Kosse (tim.kosse@filezilla-project.org)
(000040)30/04/2021 09:49:46 - (not logged in) (10.54.253.74)> 220 Please visit https://filezilla-project.org/
(000040)30/04/2021 09:49:46 - (not logged in) (10.54.253.74)> USER ice
(000040)30/04/2021 09:49:46 - (not logged in) (10.54.253.74)> 331 Password required for ice
(000040)30/04/2021 09:49:46 - (not logged in) (10.54.253.74)> PASS ***
(000040)30/04/2021 09:49:46 - ice (10.54.253.74)> 230 Logged on
(000040)30/04/2021 09:49:46 - ice (10.54.253.74)> FEAT
(000040)30/04/2021 09:49:46 - ice (10.54.253.74)> 211-Features:
(000040)30/04/2021 09:49:46 - ice (10.54.253.74)>  MDTM
(000040)30/04/2021 09:49:46 - ice (10.54.253.74)>  REST STREAM
(000040)30/04/2021 09:49:46 - ice (10.54.253.74)>  SIZE
(000040)30/04/2021 09:49:46 - ice (10.54.253.74)>  MLST type*;size*;modify*;
(000040)30/04/2021 09:49:46 - ice (10.54.253.74)>  MLSD
(000040)30/04/2021 09:49:46 - ice (10.54.253.74)>  UTF8
(000040)30/04/2021 09:49:46 - ice (10.54.253.74)>  CLNT
(000040)30/04/2021 09:49:46 - ice (10.54.253.74)>  MFMT
(000040)30/04/2021 09:49:46 - ice (10.54.253.74)>  EPSV
(000040)30/04/2021 09:49:46 - ice (10.54.253.74)>  EPRT
(000040)30/04/2021 09:49:46 - ice (10.54.253.74)> 211 End
(000040)30/04/2021 09:49:46 - ice (10.54.253.74)> OPTS UTF8 ON
(000040)30/04/2021 09:49:46 - ice (10.54.253.74)> 202 UTF8 mode is always enabled. No need to send this command.
(000040)30/04/2021 09:49:46 - ice (10.54.253.74)> SYST
(000040)30/04/2021 09:49:46 - ice (10.54.253.74)> 215 UNIX emulated by FileZilla
(000040)30/04/2021 09:49:46 - ice (10.54.253.74)> PWD
(000040)30/04/2021 09:49:46 - ice (10.54.253.74)> 257 "/" is current directory.
(000040)30/04/2021 09:49:46 - ice (10.54.253.74)> CWD /Video
(000040)30/04/2021 09:49:46 - ice (10.54.253.74)> 250 CWD successful. "/Video" is current directory.
(000040)30/04/2021 09:49:46 - ice (10.54.253.74)> CWD /
(000040)30/04/2021 09:49:46 - ice (10.54.253.74)> 250 CWD successful. "/" is current directory.
(000040)30/04/2021 09:49:46 - ice (10.54.253.74)> disconnected.
```

*WireShark Capture*
```
2715	4.351984000	10.54.253.74	10.96.209.122	TCP	66	49982?21 [SYN] Seq=0 Win=64202 Len=0 MSS=1366 WS=256 SACK_PERM=1
2716	4.352019000	10.96.209.122	10.54.253.74	TCP	66	21?49982 [SYN, ACK] Seq=0 Ack=1 Win=8192 Len=0 MSS=1460 WS=256 SACK_PERM=1
2717	4.379697000	10.54.253.74	10.96.209.122	TCP	60	49982?21 [ACK] Seq=1 Ack=1 Win=65536 Len=0
2718	4.379953000	10.96.209.122	10.54.253.74	FTP	197	Response: 220-FileZilla Server 0.9.60 beta
2721	4.429182000	10.54.253.74	10.96.209.122	FTP	64	Request: USER ice
2722	4.429243000	10.96.209.122	10.54.253.74	FTP	85	Response: 331 Password required for ice
2728	4.457772000	10.54.253.74	10.96.209.122	FTP	64	Request: PASS ice
2729	4.457867000	10.96.209.122	10.54.253.74	FTP	69	Response: 230 Logged on
2731	4.485889000	10.54.253.74	10.96.209.122	FTP	60	Request: FEAT
2732	4.485949000	10.96.209.122	10.54.253.74	FTP	176	Response: 211-Features:
2736	4.525757000	10.54.253.74	10.96.209.122	FTP	68	Request: OPTS UTF8 ON
2737	4.525795000	10.96.209.122	10.54.253.74	FTP	118	Response: 202 UTF8 mode is always enabled. No need to send this command.
2740	4.553726000	10.54.253.74	10.96.209.122	FTP	60	Request: SYST
2741	4.553761000	10.96.209.122	10.54.253.74	FTP	86	Response: 215 UNIX emulated by FileZilla
2743	4.589801000	10.54.253.74	10.96.209.122	FTP	60	Request: PWD
2744	4.589837000	10.96.209.122	10.54.253.74	FTP	85	Response: 257 "/" is current directory.
2746	4.619332000	10.54.253.74	10.96.209.122	FTP	66	Request: CWD /Video
2747	4.619398000	10.96.209.122	10.54.253.74	FTP	106	Response: 250 CWD successful. "/Video" is current directory.
2751	4.653281000	10.54.253.74	10.96.209.122	FTP	61	Request: CWD /
2752	4.653337000	10.96.209.122	10.54.253.74	FTP	101	Response: 250 CWD successful. "/" is current directory.
2765	4.684746000	10.54.253.74	10.96.209.122	TCP	60	49982?21 [RST, ACK] Seq=71 Ack=538 Win=65280 Len=0
```

The Execute() method itself is working fine though, as if I send a FEAT command, data is returned as expected.

**Logs :**

```
# Connect()
Status:   Connecting to 10.96.209.122:21
Response: 220-FileZilla Server 0.9.60 beta
Response: 220-written by Tim Kosse (tim.kosse@filezilla-project.org)
Response: 220 Please visit https://filezilla-project.org/
Status:   Detected FTP server: FileZilla
Command:  USER ***
Response: 331 Password required for ice
Command:  PASS ***
Response: 230 Logged on
Command:  FEAT
Response: 211-Features:
Response: MDTM
Response: REST STREAM
Response: SIZE
Response: MLST type*;size*;modify*;
Response: MLSD
Response: UTF8
Response: CLNT
Response: MFMT
Response: EPSV
Response: EPRT
Response: 211 End
Status:   Text encoding: System.Text.UTF8Encoding
Command:  OPTS UTF8 ON
Response: 202 UTF8 mode is always enabled. No need to send this command.
Command:  SYST
Response: 215 UNIX emulated by FileZilla

# DirectoryExists("/Video")

# GetWorkingDirectory()
Command:  PWD
Response: 257 "/" is current directory.
Command:  CWD /Video
Response: 250 CWD successful. "/Video" is current directory.
Command:  CWD /
Response: 250 CWD successful. "/" is current directory.
Command:  PORT 10,96,209,114,54,54
Status:   Disposing FtpSocketStream...
```

**Comment by robinrodricks** [comment]
Can you build in debug mode and step into Execute and see whats going on? Its pretty simple afaik.

**Comment by JimbobSquelchy** [comment]
Already done. The call to write to the network stream is made, but those bytes never seem to make it to the server (hence no response and the timeout). My client and server are in different subnets, but as the rest of the network stream makes it to the destination fine, I can't see at all why that would be an issue...!?!
