### ISSUE TITLE
FTP Server did not respond with 220 after HandShake, causing the program to be indefinitely pending

### ISSUE THREAD

**Issue by Gino1024** [robinrodricks/FluentFTP#1752]
Hi Guys,
I'm having a tricky problem, 

My Program Framework is .Net Framework 4.7.2, And I Using FluentFTP 52.1.0.0  Nuget.

When I execute the following code
_**await _ftpclient.Connect()**_
My program will get stuck in an infinite loop.

I got the following log.
_2025-05-20 15:55:12.4962 INFO [FTP-[c9e2e54c-ac5c-462b-b28e-f2089024551d][Info]Connect(False)]
2025-05-20 15:55:12.4962 INFO [FTP-[c9e2e54c-ac5c-462b-b28e-f2089024551d][Verbose]FluentFTP 52.1.0.0(.NET Framework 4.7.2) AsyncFtpClient]
2025-05-20 15:55:12.5118 INFO [FTP-[c9e2e54c-ac5c-462b-b28e-f2089024551d][Verbose]Connecting(async) AsyncFtpClient.FtpSocketStream(control) IP #1 = ***:21]
2025-05-20 15:55:12.7306 INFO [FTP-[c9e2e54c-ac5c-462b-b28e-f2089024551d][Verbose]Waiting for a response]_

However, I used wireshark to capture the packets on the host and found that after our three-way handshake was successful, the other party did not respond with 220.

So I guess the program is stuck and waiting for a response from the Server.

I have set timeout is 30 Sec 
      _**_ftpclient.Config.ConnectTimeout = timeout;
      _ftpclient.Config.ReadTimeout = timeout;
      _ftpclient.Config.DataConnectionConnectTimeout = timeout;
      _ftpclient.Config.DataConnectionReadTimeout = timeout;**_

At this point I have a question, Why doesn't my timeout work?

I delved into the source code and found that the GetReplyInternal method was used during the three-way handshake.

Notes:

**_await ((IInternalFtpClient)this).GetReplyInternal(token, null, false, 0)
await GetReply(token)
await HandshakeAsync(token);
AsyncFtpClient.Connect(bool reConnect, CancellationToken token = default(CancellationToken))_**

Maybe under normal circumstances, it is impossible for the ftp server not to respond after the three-way handshake. But I encountered,

I originally wanted to fork the source code to make corrections directly, but I saw that the version number on GitHub does not match that on NuGet, so I dare not make adjustments directly and package it for use in the production environment. What should I do?

Thank you everyone for reading.
My English expression ability may not be very good, but I hope I can improve more and more.

**Comment by FanDjango** [comment]
First thing to note:

> I have set timeout is 30 Sec

Is this windows? You need to read [this](https://github.com/robinrodricks/FluentFTP/wiki/FTP-Connection#how-do-i-change-the-connection-timeout-on-windows)

But that is not your problem.

>  the other party did not respond with 220

> Why doesn't my timeout work?

I tried here on my system with 4.7.2 and got a timeout after 15 seconds (that's the FluentFTP default for these).

> await ((IInternalFtpClient)this).GetReplyInternal(token, null, false, 0)

Yes, the 0 (zero) (or greater than 0) indicates to use `Config.ReadTimeout`.

Did you see any further traffic in the WireShark trace after the waiting has begun? Maybe we are receiving some stuff but it does not constitute a complete line? Meaning that `FtpSocketStream.ReadLine` is eating bytes, more and more, but no line ending? Maybe? Can I see the trace? Did you wait **a long long time** just be curious if the waiting is infinite?

Also, do test with a short timeout, like 5 seconds or just the default.

If you use a manual client and connect to that server, does it respond with a handshake?

**Comment by Gino1024** [comment]
Thank you for reply.

> Did you see any further traffic in the WireShark trace after the waiting has begun? Maybe we are receiving some stuff but it does not constitute a complete line? Meaning that `FtpSocketStream.ReadLine` is eating bytes, more and more, but no line ending? Maybe? Can I see the trace? Did you wait **a long long time** just to be curious if the waiting is infinite?

244	2025-05-14 10:35:07.666609	a_ip	b_ip	TCP	66	54125 → 21 [SYN, ECE, CWR] Seq=0 Win=64240 Len=0 MSS=1460 WS=256 SACK_PERM
246	2025-05-14 10:35:07.701161	b_ip	a_ip	TCP	66	21 → 54125 [SYN, ACK] Seq=0 Ack=1 Win=8190 Len=0 MSS=1460 WS=256 SACK_PERM
247	2025-05-14 10:35:07.701203	a_ip	b_ip	TCP	54	54125 → 21 [ACK] Seq=1 Ack=1 Win=262656 Len=0
... no more log 
I think the returned packet was lost

> Also, do a test with a short timeout, like 5 seconds or just the default. 
> If you use a manual client and connect to that server, does it respond with a handshake?

Because this is an occasional problem with the other party's FTP server, basically in most cases the program or Filezilla is used correctly. There is no way to simulate the error directly, I can only wait for it to appear.

After thinking about it, I adjusted the program in the github master branch and wrote a small program to test the connection with the problematic ftp server every minute. I will see if there are any good findings later.

**Comment by FanDjango** [comment]
> basically in most cases the program or Filezilla is used correctly

Ahh! So, the problem is intermittent. Ok.

> FtpSocketStream.ReadAsync seems to have...

In the master branch of GitHub, there have been some changes to this logic, so to make sure you are testing with up to date code, be sure to pick up the current master and test with that. I have made some changes to the async timeout and throwing an exception already in the last 2 days.

> I hope to find the problem through the test program!

Good luck and I am interested in the results.

**Comment by Gino1024** [comment]
I adjusted the original code to print the Log, and found that it got stuck when executing ReadAsync, and CancelToken had no effect.

To verify whether CacelToken is useful when networkStream is stuck, I tried to write a TCPListner to establish a connection but not send data or close the connection and maintain the connection, but it was really stuck.

I think the timeout mechanism of networkStream is different when reading synchronously and reading asynchronously. When I use the readasync method, it relies on the token timeout, so when reading the Stream, it gets stuck and the program can't reach the point where it checks if the token has expired or been cancelled. The Timeout of the Read method will be set in the underlying Socket ReceiveTimeout.

**Comment by Gino1024** [comment]
I get the Log!

**_2025-05-23 17:35:14.2198 INFO [FTP-[921a82de-7b96-4189-bef3-f77f05b3c495]FTP-Open，start]
2025-05-23 17:35:14.2354 INFO [FTP-[921a82de-7b96-4189-bef3-f77f05b3c495][Info]Connect(False)]
2025-05-23 17:35:14.2511 INFO [FTP-[921a82de-7b96-4189-bef3-f77f05b3c495][Verbose]FluentFTP 52.1.0.0(.NET Framework 4.7.2) AsyncFtpClient]
2025-05-23 17:35:14.2667 INFO [FTP-[921a82de-7b96-4189-bef3-f77f05b3c495][Verbose]Connecting(async) AsyncFtpClient.FtpSocketStream(control) IP #1 = ***:21]
2025-05-23 17:35:14.3136 INFO [FTP-[921a82de-7b96-4189-bef3-f77f05b3c495][Verbose]Waiting for a response]
2025-05-23 17:35:14.3292 INFO [FTP-[921a82de-7b96-4189-bef3-f77f05b3c495][Info]BaseStream.ReadAsync Start]
2025-05-23 17:35:44.3305 INFO [FTP-[921a82de-7b96-4189-bef3-f77f05b3c495][Info]cts is timeout.]
2025-05-23 17:35:44.3305 INFO [FTP-[921a82de-7b96-4189-bef3-f77f05b3c495][Verbose]Disposing(async) AsyncFtpClient.FtpSocketStream(control)]
2025-05-23 17:35:44.3305 INFO [FTP-[921a82de-7b96-4189-bef3-f77f05b3c495][Verbose]Disposing(async) AsyncFtpClient.FtpSocketStream(control) (redundant)]
2025-05-23 17:35:44.3305 INFO [FTP-[921a82de-7b96-4189-bef3-f77f05b3c495][Verbose]GetReply(...) failure: Timed out trying to read data from the socket stream!]_**

I can confirm that after the three-way handshake, the server did not respond and it got stuck.

**Comment by FanDjango** [comment]
> I am very happy to find problems and solutions, and I feel honored if I can contribute.
This is my first time participating in open source

We are honored and thank you for your perseverance.

May I, with no intention to make life difficult, ask the following:

You have discovered an interesting edge case in .NET 4.7.2, where a hung SYN-ACK-SYN will not respect a set cancel+timeout token and simply "hang" in the stream read.

I cannot reproduce this here, so **you must be the** augur who leads this process.

1. When the hang is taking place, if you wait a small while and then you **CANCEL**, does this cancel also not work? From your posts, I read that **both** the timeout **and also** the cancel of the token will not be respected.

2. Since the timeout and cancel **work fine** for 4.7.2 (on my machine and server) for a **normal** kind of no-response (like a simply "no reply to a command") which is very easy to test, it works fine, I repeat: This means that there is a special case in the .NET code (a bug????) which might have been fixed in **later** .NET versions. So I am unsure if this PR change should be restricted to 4.7.2? Although the change looks like it won't hurt later versions - is it really needed?

What do you think?

**Comment by Gino1024** [comment]
> Integration

I think I made a mistake in manipulating valueTask.

The documentation says that
The following operations should never be performed on a [ValueTask<TResult>](https://learn.microsoft.com/en-us/dotnet/api/system.threading.tasks.valuetask-1?view=net-5.0) instance:

Awaiting the instance multiple times.
Calling [AsTask](https://learn.microsoft.com/en-us/dotnet/api/system.threading.tasks.valuetask-1.astask?view=net-5.0) multiple times.
Using .Result or .GetAwaiter().GetResult() when the operation hasn't yet completed, or using them multiple times.
Using more than one of these techniques to consume the instance.
If you do any of the above, the results are undefined.

**Comment by FanDjango** [comment]
> Can you tell me how you tested for non-response? I want to try it too, to see if there is any difference

Yes. Simply connect to the server and then call the `GetReply` API. Since no command response is outstanding, it will hang until timeout, waiting for a "Reply".

> If this judgment is added and the normal flow is correct, I hope it can be added.

Yes, I think so too.

> All tests passed except for IntegrationTests_SslStream.FilezillaSsl.
The reason it failed is because the image was not found.
After checking further, I found that the
docker build filezilla --progress=plain -t filezilla:fluentftp command failed.

FileZilla building is always constantly changing somehow. I will look into it as time permits. My image works, it was built some months ago. I am happy that the docker builds (the rest of them) worked for you, we never got any amount of feedback on that.

> Did everything work fine on your end?

I will test soon with your newest changes.

**Comment by FanDjango** [comment]
One more thing:

There is an overload for `ReadAsync(...)` where you need to duplicate your changes:

```cs
		public override async ValueTask<int> ReadAsync(Memory<byte> buffer, CancellationToken token) {
...
...
```
It is right behind the one you are working on.

**Comment by FanDjango** [comment]
Integration tests are now working ok. I just tested it.

**Comment by Gino1024** [comment]
> Yes. Simply connect to the server and then call the GetReply API. Since no command response is outstanding, it will hang until timeout, waiting for a "Reply".
Thanks, I'll think about how to do it, and try again.

> FileZilla building is always constantly changing somehow. I will look into it as time permits. My image works, it was built some months ago. I am happy that the docker builds (the rest of them) worked for you, we never got any amount of feedback on that.
Your testing and writing methods are really amazing to me. 
From building my own Image to using TestcontainersContainer, I like this.

> There is an overload for ReadAsync(...) where you need to duplicate your changes:
I have made changes to this.

**Comment by FanDjango** [comment]
I am in favor of merging this. 

Let it sit for one or two days to give @robinrodricks a chance to pore over this as well and then it can be merged, to then be pending for the next release.

**Comment by Gino1024** [comment]
Hi @FanDjango,
I was wondering — do you have an estimated timeline for when this version will be released on NuGet? We'd love to use the latest changes in our project.

Thanks in advance!
